{
  "actual_adjudications_completed": 0,
  "actual_annotations_created": 0,
  "actual_annotations_locked": 0,
  "actual_coding_sessions_started": 0,
  "actual_packets_inspected": 0,
  "allocation_manifest_hash": "sha256:ce03def17f2e7aefee63e77f1296e5902de702fbea1d1748944327ea1f0a69e8",
  "blockers": [
    "coding environment unverified",
    "coder eligibility false",
    "coder training incomplete",
    "coder authorization absent",
    "session authorization absent",
    "packet hash verification not performed",
    "final authorization blocked",
    "human-coding gate blocked",
    "record-locking readiness unverified"
  ],
  "coder_registry_status": "SYNTHETIC_DRY_RUN_BLOCKED",
  "coder_schema_hash": "sha256:2abdf5f5690aada67f1694f8d83dfe95236fbcba46c1bbcfca169567dbda7b12",
  "coding_allowed": false,
  "coding_environment_status": "DRAFT_UNVERIFIED_BLOCKED",
  "created_at": "2026-07-11T00:00:00+10:00",
  "explicit_blocked_reason": "Coding environment, coder eligibility/training/authorization, session authorization, packet verification, final authorization, human-coding gate, and locking readiness remain blocked.",
  "final_authorization_status": "BLOCKED",
  "human_coding_status": "BLOCKED",
  "manual_manifest_hash": "sha256:1b80c0931a0ed8159aaeeb6e7b348331beb33130776469f223ae2a8cfe89d8de",
  "overall_status": "HUMAN_CODING_BLOCKED",
  "packet_hash_verification_status": "NOT_PERFORMED",
  "plan_status": "DRY_RUN_VALID_HUMAN_CODING_BLOCKED",
  "planned_adjudication_count": "pending_protocol_freeze",
  "planned_annotation_count": "pending_protocol_freeze",
  "planned_coder_count": "pending_protocol_freeze",
  "planned_double_coded_count": "pending_protocol_freeze",
  "private_packet_gate_status": "PASSED_WITH_CONTROLLED_ACCESS_ONLY",
  "record_hash": "sha256:d5189a8d73f7ea702609d693e6cf5bd7b4ac07876e18728953496b127126c47c",
  "rights_gate_status": "PASSED_WITH_DOWNSTREAM_GATES_BLOCKED",
  "schema_version": "1.0.0",
  "selected_case_count": 25
}
